CourseType,Description,Locations,MaximumAge,MinimumAge,Provider,SkillLevel,Title,Topics,URL
Program,"Explore 3-D design and printing — from concept and design to product creation. Using the engineering design process, you’ll identify a problem and solve it through your own invention or innovation. Turn ideas into 3-D models using SketchUp and Tnkercad software and take home a 3-D printed project.",['UW Seattle'],14,12,UW Summer Youth Programs,Beginner-Advanced,3-D Design & Printing,['Engineering'],https://www.summer-camp.uw.edu/camps-courses-masters/3-d-design-printing/
Program,"Explore 3-D design and printing — from concept and design to product creation. Using the engineering design process, you’ll identify a problem and solve it through your own invention or innovation. Turn ideas into 3-D models using SketchUp and Tnkercad software and take home a 3-D printed project.",['UW Seattle'],14,12,UW Summer Youth Programs,Beginner-Advanced,3-D Design & Printing,['Engineering'],https://www.summer-camp.uw.edu/camps-courses-masters/3-d-design-printing/
Course,"Designed for students who have already spent time programming in Java, this course will extend the student’s knowledge of programming fundamentals, concentrating on object-oriented subjects. Some of the computer science concepts taught in this course include exception handling, graphical user interfaces, designing your own classes and polymorphism.","['Downtown Seattle', 'Bellevue']",18,15,UW Summer Youth Programs,Beginner-Advanced,Coding in Java II,[],https://www.summer-camp.uw.edu/camps-courses-masters/coding-in-java-ii/
Camp,"If you like to “look under the hood” and figure out how things work, this camp is for you. Come  discover the art, science and stories behind everyday objects. This is your chance to learn about everyday inventions and make up a few of your own. With imagination as your key, who knows, you might be the next Tesla! ",['UW Seattle'],11,7,UW Summer Youth Programs,Beginner-Advanced,How Things Work,['Art'],https://www.summer-camp.uw.edu/camps-courses-masters/how-things-work/
Course,"Explore the ancient art of mosaics! Learn how to draw a mosaic design that considers positive and negative space and color, and how to work with tumbled glass, tile, adhesives and grout to bring your design to life. We’ll cover proper safety procedures for working with glass and techniques for laying thin-set mortar and grouting.",['UW Seattle'],14,12,UW Summer Youth Programs,Beginner-Advanced,Mosaic Arts,['Art'],https://www.summer-camp.uw.edu/camps-courses-masters/mosaic-arts/
Course,"A protostar is the earliest phase of star formation, and this course will launch you to the first phase of becoming an astronomer! In this girls-only program, come learn about how stars form, live and die, and how they build up galaxies (like our home, the Milky Way). Use the tools and methods that professional astronomers use to uncover the mysteries of our universe! Students can look forward to guest speakers, a visit to the UW Planetarium, and activities integrating math, physics and science concepts. Invite your family and friends to join you at the end of the session for our own astronomy ""conference,"" where you can share what you have learned. ",['UW Seattle'],14,12,UW Summer Youth Programs,Beginner-Advanced,Protostars,[],https://www.summer-camp.uw.edu/camps-courses-masters/protostars/
Course,"This workshop will challenge students to approach writing through a variety of rhetorical modes, including narrative, poetry, short fiction, vignette and re-appropriation. Class time will be divided among mini-lessons, independent writing time, group work and one-to-one conferencing. You'll experience the similarities of each genre as we reinforce the notion that good writing is a result of rewriting. Writers will complete and present a portfolio at the end-of-course publishing party. Students should plan on bringing a laptop to class.","['Bellevue', 'UW Seattle']",18,15,UW Summer Youth Programs,Beginner-Advanced,Writers Workshop,['Art'],https://www.summer-camp.uw.edu/camps-courses-masters/writers-workshop/
Camp,"Calling all actors! Are you ready to jump in, work hard, have fun and shine? Join us for an eight-day drama camp taught by professional actors Angela and Terence Kelley. You’ll learn all aspects of what it takes to put on a show, from auditions and building sets to acting and choreography. Play theater games and put your acting skills through their paces as we rehearse for our full production of the classic The Wizard of Oz!",['UW Seattle'],12,9,UW Summer Youth Programs,Beginner-Advanced,Drama Camp: The Wizard of Oz,[],https://www.summer-camp.uw.edu/camps-courses-masters/drama-camp-the-wizard-of-oz/
